{
  "inputs": {
    "forest_case": {
      "bytes": 910,
      "sha256": "bbfbd997d1e5e9b6a22a327425ff5db4ede6deb204a24d282389f2c0935832be"
    },
    "forest_pixels": {
      "bytes": 914,
      "sha256": "0d195d3d38e4a04901866c3f7c9456c2a51f9b363eb35665707ed4d640a9c6f7"
    },
    "forest_reference_mask": {
      "bytes": 239,
      "sha256": "dccbb35d095902e04198f24d9573de51af9678c735e7f9429463b96ef6de74f4"
    },
    "legal_corpus": {
      "bytes": 10364,
      "sha256": "8830e3d79d7698dfe3c24833f94395b1626cabf6377ac32a3a27aa42f2e9c374"
    },
    "legal_eval": {
      "bytes": 11754,
      "sha256": "6e7a1a9665aa3e42dae01e38096464440a184fe81124f1c2ce24b637364cd3b0"
    },
    "legal_source_manifest": {
      "bytes": 1914,
      "sha256": "b1f3b4588675fcbe804480bfb46ba90e58282ad196301ba28dddb3e19ae3f8dd"
    },
    "normalization_policy": {
      "bytes": 836,
      "sha256": "d9f52ac2b6272686ccb9741a053ee2c98f6c1f4d196bc7c0169485e4bb71383a"
    },
    "trade_case_documents": {
      "bytes": 5354,
      "sha256": "0f4f54ff9e9d7c36f38bf345b9ba0f4a56b4429e1fc396f38966f6d0abf33566"
    }
  },
  "outputs": {
    "cbam_exposure": {
      "bytes": 76338,
      "sha256": "357d420c37a01ad04953761020ca67953f841f06bc48f21cc614d6e386ceddd5"
    },
    "evidence_report_html": {
      "bytes": 35752,
      "sha256": "8f6c849dbf9c1a8b8e32f3e9eef92a3c2279014b0ac1a47cfcac43621231203a"
    },
    "evidence_report_json": {
      "bytes": 818918,
      "sha256": "8e953cadc79b9b0735c32db4ab795d83869a7aa972a91b6aa5fda77a596fc9d8"
    },
    "extracted_records": {
      "bytes": 28297,
      "sha256": "128df39053592213aed8c58c5e81d1151c23ce0b8faf07527ecbdf7b37973222"
    },
    "forest_change": {
      "bytes": 12421,
      "sha256": "312dca34014777ff55da7cde23e825166e0955ef2c75ea3c765bb358cfe5a136"
    },
    "forest_change_geojson": {
      "bytes": 34477,
      "sha256": "301f210bd85057097cdd40031eef89318a333a30bc29710bbcb7b73ae6374ace"
    },
    "forest_change_svg": {
      "bytes": 11901,
      "sha256": "2c9cd1ec17dfbfa33302fd0f330d326053e972669cba487ab0d5b83f4a5e2c5e"
    },
    "legal_issue_citations": {
      "bytes": 35565,
      "sha256": "9486c487be283b3d92f0cd7e0b3e8722ecfa65d36ba934691f0cfbec682d34b4"
    },
    "legal_retrieval_evaluation": {
      "bytes": 527086,
      "sha256": "70dad87acd648b6fd2a87561486e8532a03a5160758ee27e5a130301df5de977"
    },
    "normalized_evidence": {
      "bytes": 89613,
      "sha256": "72b09c765314ea7578e9df5c32a826098956e58c24c317622fed8aebb31bf205"
    }
  },
  "pipeline_version": "0.5.0",
  "schema_version": "artifact-manifest/1.0",
  "verification": "Re-run `python -m ecoguard reproduce` and compare SHA-256 values or execute `./scripts/verify_release.sh` for a wheel-installed exact diff."
}
